{
  "$schema": "http://json-schema.org/draft-07/schema#",
  "type": "object",
  "properties": {
    "name": {
      "type": "string"
    },
    "description": {
      "type": "string"
    },
    "homepage": {
      "type": "string",
      "format": "uri"
    },
    "logo": {
      "type": "string",
      "format": "uri"
    },
    "license": {
      "type": "object",
      "properties": {
        "identifier": {
          "type": "string"
        },
        "url": {
          "type": "string",
          "format": "uri"
        }
      }
    },
    "bios": {
      "type": "string",
      "enum": [
        "required",
        "optional"
      ]
    },
    "repository": {
      "type": "object",
      "properties": {
        "type": {
          "type": "string",
          "enum": [
            "git"
          ]
        },
        "url": {
          "type": "string",
          "format": "uri"
        }
      }
    },
    "downloads": {
      "type": "object",
      "patternProperties": {
        "^(?:(aix|darwin|freebsd|linux|openbsd|sunos|win32|android):(arm|arm64|ia32|mips|mipsel|ppc|ppc64|s390|s390x|x32|x64))*$": {
          "type": "array",
          "items": {
            "oneOf": [
              {
                "type": "object",
                "properties": {
                  "type": {
                    "const": "github"
                  },
                  "host": {
                    "type": "string",
                    "format": "uri"
                  },
                  "bin": {
                    "type": "string"
                  },
                  "pattern": {
                    "type": "string"
                  },
                  "path": {
                    "type": "string"
                  }
                },
                "required": [
                  "path",
                  "pattern"
                ]
              },
              {
                "type": "object",
                "properties": {
                  "type": {
                    "const": "direct"
                  },
                  "url": {
                    "type": "string",
                    "format": "uri"
                  },
                  "bin": {
                    "type": "string"
                  }
                },
                "required": [
                  "url"
                ]
              },
              {
                "type": "object",
                "properties": {
                  "type": {
                    "const": "scoop"
                  },
                  "url": {
                    "type": "string",
                    "format": "uri"
                  }
                },
                "required": [
                  "url"
                ]
              }
            ],
            "unevaluatedProperties": false,
            "required": [
              "type"
            ]
          }
        }
      },
      "additionalProperties": false
    },
    "aliases": {
      "type": "object",
      "properties": {
        "winget": {
          "type": "string"
        },
        "scoop": {
          "type": "string"
        },
        "flatpak": {
          "type": "string"
        }
      },
      "additionalProperties": false
    },
    "type": {
      "type": "string",
      "enum": [
        "emulator"
      ]
    },
    "systems": {
      "type": "array",
      "items": {
        "type": "string"
      }
    },
    "os": {
      "type": "array",
      "items": {
        "type": "string"
      }
    },
    "keywords": {
      "type": "array",
      "items": {
        "type": "string"
      }
    },
    "funding": {
      "type": "string",
      "format": "uri"
    },
    "notes": {
      "type": "array",
      "items": {
        "type": "string"
      }
    }
  },
  "required": [
    "name",
    "description",
    "logo",
    "license",
    "type"
  ],
  "additionalProperties": false
}