{
    "name": "AZAHAR",
    "description": "An open-source 3DS emulator project based on Citra.",
    "homepage": "https://azahar-emu.org/",
    "logo": "https://azahar-emu.org/resources/images/logo/azahar-logo.svg",
    "license": {
        "identifier": "GPL-2.0",
        "url": "https://github.com/azahar-emu/azahar/blob/master/license.txt"
    },
    "repository": {
        "type": "git",
        "url": "https://github.com/azahar-emu/azahar.git"
    },
    "downloads": {
        "win32:x64": [
            {
                "type": "github",
                "path": "azahar-emu/azahar",
                "pattern": "azahar-*-windows-msvc.zip"
            }
        ],
        "linux:x64": [
            {
                "type": "github",
                "path": "azahar-emu/azahar",
                "pattern": "azahar-wayland.AppImage"
            }
        ]
    },
    "aliases": {
        "winget": "AzaharEmu.Azahar",
        "scoop": "games/azahar",
        "flatpak": "org.azahar_emu.Azahar"
    },
    "type": "emulator",
    "bios": "required",
    "systems": [
        "3ds"
    ],
    "os": [
        "win32",
        "linux",
        "darwin",
        "android"
    ]
}