{
    "name": "RPCS3",
    "description": "RPCS3 is a multi-platform open-source Sony PlayStation 3 emulator and debugger written in C++ for Windows, Linux, macOS and FreeBSD.",
    "homepage": "https://rpcs3.net/",
    "logo": "https://upload.wikimedia.org/wikipedia/commons/c/c5/RPCS3_logo.png",
    "license": {
        "identifier": "GPL-2.0",
        "url": "https://github.com/RPCS3/rpcs3/blob/master/LICENSE"
    },
    "keywords": [
        "c",
        "emulation",
        "emulator",
        "opengl",
        "playstation3",
        "ps3",
        "multiplatform"
    ],
    "repository": {
        "type": "git",
        "url": "https://github.com/RPCS3/rpcs3.git"
    },
    "downloads": {
        "win32:x64": [
            {
                "type": "github",
                "path": "RPCS3/rpcs3-binaries-win",
                "pattern": "rpcs3-*_win64_msvc.7z"
            },
            {
                "type": "scoop",
                "url": "https://cdn.jsdelivr.net/gh/Calinou/scoop-games@latest/bucket/rpcs3.json"
            }
        ],
        "win32:arm64": [
            {
                "type": "github",
                "path": "RPCS3/rpcs3-binaries-win-arm64",
                "pattern": "rpcs3-*_win64_aarch64_clang.7z "
            },
            {
                "type": "scoop",
                "url": "https://cdn.jsdelivr.net/gh/Calinou/scoop-games@latest/bucket/rpcs3.json"
            }
        ],
        "linux:x64": [
            {
                "type": "github",
                "path": "RPCS3/rpcs3-binaries-linux",
                "pattern": "rpcs3-*_linux64.AppImage"
            }
        ],
        "linux:arm64": [
            {
                "type": "github",
                "path": "RPCS3/rpcs3-binaries-linux-arm64",
                "pattern": "rpcs3-*_linux_aarch64.AppImage"
            }
        ],
        "darwin:x64": [
            {
                "type": "github",
                "path": "RPCS3/rpcs3-binaries-mac",
                "pattern": "rpcs3-*_macos.7z"
            }
        ],
        "darwin:arm64": [
            {
                "type": "github",
                "path": "RPCS3/rpcs3-binaries-mac-arm64",
                "pattern": "rpcs3-*_macos_aarch64.7z"
            }
        ]
    },
    "aliases": {
        "winget": "PPSSPPTeam.PPSSPP",
        "scoop": "games/rpcs3",
        "flatpak": "net.rpcs3.RPCS3"
    },
    "type": "emulator",
    "bios": "required",
    "systems": [
        "ps3"
    ],
    "os": [
        "win32",
        "darwin",
        "linux"
    ]
}