{
    "name": "DUCKSTATION",
    "description": "DuckStation is a PS1 Emulator aiming for the best accuracy and game support.",
    "homepage": "https://www.duckstation.org/",
    "logo": "https://www.duckstation.org/assets/img/duck_head.svg",
    "license": {
        "identifier": "CC-BY-NC-ND-4.0",
        "url": "https://github.com/stenzek/duckstation/blob/master/LICENSE"
    },
    "repository": {
        "type": "git",
        "url": "https://github.com/stenzek/duckstation.git"
    },
    "downloads": {
        "win32:x64": [
            {
                "type": "github",
                "path": "stenzek/duckstation",
                "pattern": "duckstation-windows-x64-release.zip"
            }
        ],
        "win32:arm64": [
            {
                "type": "github",
                "path": "stenzek/duckstation",
                "pattern": "duckstation-windows-arm64-release.zip"
            }
        ],
        "linux:x64": [
            {
                "type": "github",
                "path": "stenzek/duckstation",
                "pattern": "DuckStation-x64.AppImage"
            }
        ],
        "linux:arm64": [
            {
                "type": "github",
                "path": "stenzek/duckstation",
                "pattern": "DuckStation-arm64.AppImage"
            }
        ]
    },
    "aliases": {
        "winget": "Stenzek.DuckStation",
        "scoop": "games/duckstation"
    },
    "type": "emulator",
    "systems": [
        "psx"
    ],
    "os": [
        "win32",
        "linux",
        "darwin"
    ]
}