{
    "name": "CEMU",
    "description": "Nintendo GameCube and Wii emulator, with enhancements and Netplay",
    "homepage": "https://cemu.info/",
    "logo": "https://upload.wikimedia.org/wikipedia/commons/9/9e/Cemu_Emulator_Official_Logo.png",
    "license": {
        "identifier": "MPL-2.0",
        "url": "https://github.com/cemu-project/Cemu/blob/main/LICENSE.txt"
    },
    "repository": {
        "type": "git",
        "url": "https://github.com/cemu-project/Cemu.git"
    },
    "downloads": {
        "win32:x64": [
            {
                "type": "github",
                "path": "cemu-project/Cemu",
                "pattern": "cemu-*-windows-x64.zip"
            },
            {
                "type": "scoop",
                "url": "https://cdn.jsdelivr.net/gh/Calinou/scoop-games@master/bucket/cemu.json"
            }
        ],
        "linux:x64": [
            {
                "type": "github",
                "path": "cemu-project/Cemu",
                "pattern": "Cemu-*-x86_64.AppImage"
            }
        ]
    },
    "keywords": [
        "cemu",
        "emulation",
        "cpp",
        "nintendo",
        "wiiu"
    ],
    "aliases": {
        "winget": "Cemu.Cemu",
        "scoop": "games/cemu",
        "flatpak": "info.cemu.Cemu"
    },
    "type": "emulator",
    "systems": [
        "wiiu"
    ],
    "os": [
        "win32",
        "linux",
        "darwin"
    ]
}